{"active_behavior_authorization":false,"artifact_inventory":[{"artifact_id":"artifact.source.fixture","content_sha256":"1111111111111111111111111111111111111111111111111111111111111111"}],"behavior_catalog_ref":{"document_id":"adaptive_runtime_effective_behavior_catalog_v1","schema_version":"adaptive-runtime-effective-behavior-catalog-v1","document_version":1,"content_sha256":"0d6346d8edd074c20e460b52308913276783008d5078829b1a937f2990f52656"},"binary_cohort_id":"binary.cohort.fixture","classifications":[{"classification_id":"classification.1003.negative","kind":"negative","operation_id":1003,"retained":true}],"connection_epochs":[{"connection_key":"connection.fixture.1","epoch_sequence":1,"run_id":"run.correctness.fixture"}],"connection_key":"connection.fixture.1","content_sha256":"7306f687fef76b55a5407f177906272ec856445c84bba08c7e9a5b2e62ce52d8","decisions":[{"applied_value":"legacy_current","axis_id":"application_send_batch_formation","candidate_value":"single_eligible","configured_value":"legacy_current","decision_instance_id":103,"epoch_sequence":1,"forced_value":"single_eligible","shadow_recommendation":null}],"declared_aggregates":[],"document_id":"verification_only_equivalent_cell_retained.warning","document_version":1,"epoch_sequence":1,"operations":[{"applied_bytes":0,"applied_value":"legacy_current","applied_work_count":0,"axis_id":"application_send_batch_formation","candidate_value":"single_eligible","decision_instance_id":103,"effective_behavior_id":null,"epoch_sequence":1,"fallback_or_safety_reason":"retained_negative","legal_bytes":0,"legal_work_count":0,"mechanism_event":"batch_no_packet_plan","operation_eligibility_reason":"resource_guard","operation_eligibility_result":"clamped","operation_id":1003,"result":"negative","source_event_kind":"axis_specific_mechanism","terminal_outcome":"packet_plan_abandoned"}],"performance_acceptance_authorization":false,"releases":[],"result_epoch_sequence":1,"run_id":"run.correctness.fixture","schema_version":"adaptive-runtime-operation-evidence-v1","trace_references":{"architecture_ids":["ARC-QUIC-CRT-0095"],"requirement_ids":["REQ-QUIC-CRT-0206","REQ-QUIC-CRT-0207","REQ-QUIC-CRT-0208","REQ-QUIC-CRT-0209"],"verification_ids":["VER-QUIC-CRT-0097"],"work_item_ids":["WI-QUIC-CRT-0096"]}}